project,abstract
การปรับปรุงสภาพงานโดยใช้หลักการยศาสตร์แบบมีส่วนร่วม เพื่อลดความเสี่ยงของการบาดเจ็บจากการทํางาน,งานชั่งน้ำหนักเป็นงานที่มีความเสี่ยงด้านการยศาสตร์สูง เพราะจะต้องยืนทำงาน มีการ ก้ม เงย เอี้ยวตัว บิดข้อมือขณะ ยกและวางสินค้า ใช้แรงอย่างต่อเนื่องเป็นเวลานาน ส่งผลให้เกิดความผิดปกติของระบบกล้ามเนื้อและกระดูกโดยเฉพาะบริเวณหลังส่วนล่าง การวิจัยกึ่งทดลองครั้งนี้มีวัตถุประสงค์เพื่อ ลดความเสี่ยงของการบาดเจ็บจากการทำงานโดยใช้หลักการยศาสตร์แบบมีส่วนร่วม ในพนักงานประกอบของบริษัท ทำการเลือกกลุ่มตัวอย่างแบบเจาะจงตามเงื่อนไขที่กำหนด จำนวน 4 คน เครื่องมือที่ใช้เก็บข้อมูล ได้แก่ แบบประเมิน Rapid Upper Limp Assessment (RULA) แบบประเมินความรู้สึกปวด ผลการวิจัยพบว่า การปรับปรุงสภาพงานชั่งน้ำหนักที่สามารถดำเนินการได้โดยใช้หลัก การยศาสตร์แบบมีส่วนร่วม ประกอบด้วย การออกแบบกระเช้าในการบรรจุสินค้าก่อนขึ้นเครื่องช่างน้ำหนักใหม่ การเพิ่มแม่แรงไฮโดรลิคเพื่อสทำให้พนักงานสามารถปรับระดับความสูงของท่าทางการทำงานให้สอดคล้องกับความสูงของสินค้าภายในกระเช้า การจัดอบรมท่าทางการทำงานที่ถูกต้องให้กับพนักงานเพื่อลดความเสี่ยงของการบาดเจ็บจากการทำงาน ท่าทางการทำงานที่ไม่ถูกต้องตามหลักการยศาสตร์ด้วยการประเมินด้วย RULA และความรู้สึกปวดร่างกายลดลงอย่างมีนัยสำคัญ งานศึกษาในครั้งนี้จึงเป็นข้อมูลพื้นฐานให้โรงงานแปรรูปอลูมิเนียมอื่น ๆ หรือสถานประกอบการที่มีลักษณะปัญหาใกล้เคียง ได้นำรูปแบบไปใช้ในการปรับปรุงสภาพงานเพื่อลดความเสี่ยงทางด้านการยศาสตร์ต่อไป
การศึกษาวิเคราะห์งบการเงินของบริษัทซัพพลายเออร์ กรณีศึกษาบริษัทผู้ผลติชิ้นส่วนยานยนต์แห่งหนึ่งในจังหวัดระยอง,ในการศึกษาครั้งนี้เป็นการวิเคราะห์งบการเงินของบริษัทซัพพลายเออร์ กลุ่มอุตสาหกรรมผู้ผลิตชิ้นส่วนยานยนต์แห่งหนึ่งในจังหวัดระยอง โดยมีวัตถุประสงค์ของการศึกษา 1) เพื่อวิเคราะห์ความเสี่ยงงบการเงินของบริษัทซัพพลายเออร์ (single source) จำนวน 5 2) เพื่อวิเคราะห์ผลการดำเนินงานและผลกำไรขาดทุนของบริษัทซัพพลายเออร์ (single source) จำนวน 5 3) เพื่อเป็นแนวทางและข้อมูลการคัดเลือกซัพพลายเออร์ให้กับบริษัท การศึกษานี้มีวิธีการเก็บรวบรวมข้อมูลทางการเงินของบริษัทซัพพลายเออร์จาก กรมพัฒนาธุรกิจการค้า https://www.dbd.go.th/ จำนวน 5 บริษัทในระหว่างปี พ.ศ. 2561 - พ.ศ. 2563 และทำการวิเคราะห์ข้อมูลโดยใช้เครื่องมือทางการเงินมาช่วยวิเคราะห์และสรุปผล จากผลการศึกษาการวิเคราะห์งบการเงินซัพพลายเออร์ทั้ง 5 A มีความสามารถในการจ่ายดอกเบี้ยได้ดีในปีพ.ศ. 2563 ส่วนยอดกำไรสุทธิมีแนวโน้มเพิ่มขึ้น แม้จะมีค่าร้อยละติดลบก็ตาม โดยในปี 2563 มีผลตอบแทนที่เพิ่มขึ้นถึง อัตราร้อยละ (-0.56) จากปีก่อนในอัตราร้อยละ (-57.50)ทำให้เห็นถึงความสามารถที่ทำให้กำไรของกิจการขยับเพิ่มขึ้นได้เป็นผลในทางที่ดีที่กิจการจะสามารถทำให้กำไรในปีถัดไปเกิดการเพิ่มยอดได้ดีมากขึ้น บริษัทB มีอัตราเงินทุนหมุนเวียนและความสามารถจัดการสถาพคล่องรายได้ดีที่สุด อัตรายอดกำไรสุทธิมีแนวโน้มลดลง โดยในปี 2563 มีผลตอบแทนที่ลดลงถึง อัตราร้อยละ 55.18เมื่อเทียบจากปีก่อนในอัตราร้อยละ 89.13 C มีความสามารถจัดการการขายและบริหารได้ดี อัตราการขยายตัวของรายได้ในช่วงระยะเวลา 3 ปี มีแนวโน้มเพิ่มขึ้นและอัตราการขยายตัวของต้นทุนขายก็มีแนวโน้มเพิ่มขึ้นเช่นกันบริษัท D มีความสามารถการดำเนินงานควบคุมการผลิตที่ดี อัตรายอดกำไรสุทธิมีแนวโน้มลดลง โดยในปี 2561 มีอัตราร้อยละที่ 388.66 ปี 2562 มีอัตราร้อยละที่ 153.05 มีผลตอบแทนที่ลดลงจากครึ่งต่อครึ่ง ส่วนในปี 2563 มีอัตราร้อยละที่ 125.33 ซึ่งก็ลดลงมาจากปีก่อน เป็นผลมาจากรายได้การขายที่ลดลงมาจึงทำให้บริษัทมีแนวโน้มกำไรที่ลดลง E มีความสามารถจัดการสภาพคล่องได้ค่อนข้างดี แต่มีอัตราหนี้สินต่อส่วนของเจ้าของสูงทำให้บริษัท E มีภาระหนี้มากเกินไป อัตราการขยายตัวของต้นทุนขายมีแนวโน้มที่ลดลง ยอดกำไรสุทธิมีแนวโน้มลดลงเห็นได้ชัดเจนจากปี 2562 ซึ่งมีอัตราร้อยละ 217.13 และปี 2563 อัตราร้อยละลดลงมาที่ 23.13
การศึกษากระบวนการ และประโยชน์ของการทำ Scrap,การผลิตในอุตสาหกรรมนั้นเป็นการนำวัตถุดิบหรือผลิตภัณฑ์มาผ่านกระบวนการต่างๆ เพื่อตอบสนองต่อความต้องการของลูกค้า และสร้างผลกำไรให้แก่บริษัท แต่การผลิตและการนำเข้าวัตถุดิบหรือผลิตภัณฑ์ อาจมีส่วยที่ได้รับความเสียหายได้ จากสาเหตุต่างๆทั้งปัจจัยภายใน และปัจจัยภายนอก จึงต้องนำวัตถุดิบหรือผลิตภัณฑ์ที่เสียหายจนไม่สามารถก่อให้เกิดมูลค่าเพิ่มและไม่สามารถสร้างกำไรให้แก่บริษัทได้ ไปทำลายเพื่อไม่ให้เกิดค่าใช้จ่ายในส่วนอื่นๆ เช่น ค่าใช้จ่ายในการจัดเก็บสินค้าคงคลัง และลดค่าใช้จ่ายในการดูแลสินค้า และเพื่อสามารถนำพื้นที่ส่วนที่จัดเก็บวัตถุดิบหรือผลิตภัณฑ์ที่เสียหายไปใช้ประโยชน์ในการจัดเก็บวัตถุดิบหรือผลิตภัณฑ์ที่สามารถนำไปใช้เพื่อตอบสนองความต้องการของลูกค้าได้ ผู้วิจัยจึงมีความประสงค์ที่จะศึกษาและวิเคราะห์ปัจจัยสำคัญที่ก่อให้เกิดการทำ Scrap ของวัตถุดิบหรือผลิตภัณฑ์ที่เกิดความเสียหายและไม่สามารถนำมาซึ่งการก่อให้เกิดมูลค่าเพิ่มได้ และอัตราการเกิด Scrap จากปัจจัยต่างๆ ที่ไม่สามารถควบคุมได้ ตลอดจนขั้นตอนและวิธีการ การทำ Scrap เพื่อให้เกิดประสิทธิภาพสูงสุดในการปฏิบัติงาน
การศึกษาและวิเคราะห์กระบวนการทำงานของสายพานลำเลียงภายในคลังสินค้า,งานวิจัยนี้เป็นการศึกษาและวิเคราะห์กระบวนการทำงานของสายพานลำเลียงภายในคลังสินค้า เพื่อวิเคราะห์ถึงเวลาการทำงานในแต่ละส่วนทั้งก่อนใช้และหลังใช้สายพานลำเลียงมาเปรียบเทียบกัน ว่าขั้นตอนการทำงานใดเร็วขึ้นบ้าง แล้วนำผลลัพธ์จากการเก็บรวบรวมข้อมูลมาวิเคราะห์ถึงเวลาการทำงานในแต่ละส่วนโดยจับเวลาเพื่อหาค่าเฉลี่ย มากสุด น้อยสุด จากนั้นจึงเสนอแนวทางในกาพัฒนากระบวนการทำงานของสายพานลำเลียงโดยใช้เครื่องมือ ECRS มาปรับใช้กับกระบวนการทำงานของสายพานลำเลียงเพื่อลดการเกิดความสูญเปล่าในด้านเวลาและขั้นตอนการทำงาน จากการศึกษาพบว่า กระบวนการทำงานทั้งขาเข้าจากโรงงานมิชลินพระประแดง (Inbound STP) และขาออกส่งไปโรงงาน (Outbound OE) แบบที่ใช้สายพานลำเลียงมีระยะเวลาในการดำเนินงานเร็วกว่าแบบเก่า โดยขาเข้าจากโรงงานมิชลินพระประแดง (Inbound STP) แบบที่ใช้สายพานลำเลียงมีระยะเวลาเฉลี่ยอยู่ที่ 156.9 นาที ซึ่งใช้เวลาในการดำเนินงานน้อยกว่าแบบเก่าที่มีระยะเวลาเฉลี่ยอยู่ที่ 226.6 นาที ส่งผลให้มีผลิตภาพเพิ่มขึ้น 30.76% และขาออกส่งไปโรงงาน (Outbound OE)แบบที่ใช้สายพานลำเลียงมีระยะเวลาเฉลี่ยอยู่ที่ 156.4นาที ซึ่งใช้เวลาในการดำเนินงานน้อยกว่าแบบเก่าที่มีระยะเวลาเฉลี่ยอยู่ที่ 165.6 นาที ส่งผลให้มีผลิตภาพเพิ่มขึ้น 5.56 %
การศึกษาแนวทางการป้องกันปัญหาวัตถุดิบขาดแคลนของกระบวนการนำเข้าแลคโตส,"งานวิจัยนี้มีจุดประสงค์ เพื่อศึกษาแนวทาง ขั้นตอน และกระบวนการนำเข้าวัตถุดิบ (Raw Materials) เพื่อป้องกันไม่ให้เกิดปัญหาวัตถุดิบขาดแคลน ซึ่งการศึกษาในครั้งนี้จะเป็นการศึกษากระบวนการนำเข้าวัตถุดิบของบริษัทกรณีศึกษา และวิเคราะห์ถึงเหตุผลของปัญหา จากนั้นจึงศึกษาแนวทางการรับมือการนำเข้าของวัตถุดิบและนำมาวิเคราะห์การควบคุมสินค้าคงคลังเพื่อป้องกันไม่ให้เกิดปัญหาวัตถุดิบขาดแคลน เมื่อได้รูปแบบการกำหนดสินค้าคงคลังสำรองแล้ว ให้นำมาประยุกต์ใช้กับบริษัทกรณีศึกษาเพื่อหาแนวทางการรับมือปัญหาวัตถุดิบขาดแคลน ดังนั้น ในงานวิจัยนี้จึงได้มีแนวคิดนำการกำหนดสินค้าคงคลังสำรอง (Safety Stock) มาประยุกต์ใช้ เพื่อให้ทราบถึงแนวทางการกำหนดปริมาณสินค้าคงคลังสำรองที่เหมาะสม จากการคำนวณพบว่าหากบริษัทต้องการมีสินค้าคงคลังสำรองเพื่อป้องกันสินค้าขาดแคลน บริษัทต้องสั่งวัตถุดิบเพิ่มขึ้นในแต่ละเดือนของปี 2564 ประมาณ 187,173 ชิ้น เฉลี่ยแล้วอยู่ที่ปริมาณ 335,591 ชิ้น จากอุปสงค์ความต้องการของวัตถุดิบประเภทแลคโตสที่กำลังมีปัญหาขาดแคลนอยู่ขณะนี้ ซึ่งเป็นปริมาณสินค้าคงคลังที่เหมาะสมสำหรับการจัดเก็บสำรองในช่วงสถานการณ์วัตถุดิบขาดแคลนที่บริษัทต้องเผชิญ"
การเพิ่มประสิทธิภาพการทํารับสินค้าโดยการใช้เทคโนโลยี Radio Frequency Identification,"การที่บริษัทโรเบิร์ต เทคโนโลยี นำเทคโนโลยี RFID (Radio Frequency Identification) มาประยุกต์ใช้กับการทำรับสินค้าในคลังสินค้าเพื่อการจัดเก็บ ติดตาม และตรวจสอบสถานะของสินค้าในคลังสินค้าแล้วนั้น ยังสามารถนำข้อมูลที่ได้นั้นมาจำแนกประเภทของสินค้าที่เกิดการส่งออกและนำเข้ามากที่สุด สามารถคำนวณหาค่าพยากรณ์ความต้องการในแต่ละเดือนได้อีกด้วย ในการจัดทำโครงการนี้ คณะผู้จัดทำได้นำโปรแกรม Microsoft Excel เข้ามาใช้ในการรวบรวมข้อมูลที่ได้จากการทำรับสินค้าจากการใช้เทคโนโลยี RFID ทำให้ง่ายต่อการติดตาม และตรวจสอบสถานะของสินค้า ผลจากการดำเนินงานตรงตามวัตถุประสงค์ที่กำหนดไว้ซึ่งคณะผู้จัดทำได้รับประโยชน์ในเรื่องของการศึกษาระบบภายในคลังสินค้า (บริษัท คูห์เน่ พลัส นาเกิ้ล),ได้ศึกษาขั้นตอนในการดำเนินงานภายในคลังสินค้าก่อนที่จะนำเทคโนโลยี RFID มาใช้, การนำเทคโนโลยี RFID สามารถลดต้นทุนการทำงาน ลดระยะเวลา ลดพนักงาน และยังสามารถเพิ่มประสิทธิภาพในการทำงานได้ ABSTRACT Robert Bosch Automotive Technology (Thailand) Co., Ltd. has applied RFID (Radio Frequency Identification) technology to warehouse receipts for storage, tracking and monitoring of the status of goods in the warehouse. then can also use the information obtained to classify the types of products that are most exported and imported Able to calculate demand forecast for each month as well. In the preparation of this project The organizers have brought Microsoft Excel to be used to collect data obtained from receiving products using RFID technology, making it easy to sneeze. and check the status of the product. The results of operations meet the stated objectives, which the organizers benefit in the matter of studying the system within the warehouse (Kuhne+Nagle Company), having studied the steps in the warehouse operations before Adopt RFID technology, adopting RFID technology can reduce operating costs, shorten time, reduce workforce, and can also increase work efficiency. สารบัญ บทที่หน้า"
การศึกษาและการวิเคราะห์กระบวนการขาออกด้วยอุปกรณ์ฟาสต์เลน,งานวิจัยนี้มีวัตถุประสงค์เพื่อศึกษาและวิเคราะห์กระบวนการขนถ่ายสินค้าขาออกทั้งในรูปแบบที่ใช้สายพานลำเลียง (Conveyor) และแบบที่สวมแหวน (Fastlane) เพื่อตรวจสอบข้อบกพร่องและเพื่อแก้ไขข้อผิดพลาดต่าง ๆ ของแผนก Michelin TSW ของบริษัท ( ไทยแลนด์ ) โดยทำการเก็บรวบรวมข้อมูลด้วยการศึกษากระบวนการดำเนินงานในคลังสินค้า สอบถามกระบวนการดำเนินงานต่าง ๆ จากผู้ปฏิบัติงานในคลังสินค้า จากการศึกษาพบว่า กระบวนการขนถ่ายสินค้าทั้งในรูปแบบที่ใช้สายพานลำเลียง (Conveyor) และแบบที่สวมแหวน (Fastlane) มีข้อบกพร่องที่ยังต้องดำเนินงานแก้ไข เนื่องจากทั้ง 2 กระบวนการได้มีการนำมาใช้พร้อมกับการเปิดใช้งานคลังสินค้าแห่งใหม่ Michelin TSW กระบวนการขนถ่ายสินค้าทั้งในรูปแบบที่ใช้สายพานลำเลียง (Conveyor) และแบบที่สวมแหวน (Fastlane) จึงอยู่ในขั้นทดลองการดำเนินงาน ทำให้ดำเนินงานได้ไม่ต่อเนื่อง การขนถ่ายสินค้าก็ใช้ระยะเวลานานขึ้น และระบบในการทำงานยังไม่เสถียรเท่าที่ควร จากการแก้ไขกระบวนการดำเนินงานที่ผ่านมา ทำให้ระบบในการดำเนินงานเสถียรมากขึ้น กระบวนการขนถ่ายสินค้าขาออกมีผลิตภาพที่เพิ่มขึ้นถึง 29.41%
