project,abstract
การสงวนสิทธิ์และการขอคืนภาษีอากรในการใช้สิทธิ์ภายใต้ขอตกลงการค้าการค้าเสรีไทย-ญี่ปุ่น (JTEPA),งานวิจัย การสงวนสิทธิ์และการขอคืนภาษีอากรในการใช้สิทธิ์การค้าเสรีไทย-ญี่ปุ่น (FTA form JTEPA) มีวัตถุประสงค์เพื่อเพิ่มประสิทธิภาพและศึกษากระบวนการสงวนสิทธิ์และการขอคืนภาษีอากรตามข้อตกลงการค้าเสรี ไทย – ญี่ปุ่น ซึ่งสามารถลดระยะเวลาในการทำงานด้านการขอคืนแต่ละชิปเม้นตั้งแต่กระบวนการแรกถึงกระบวนการสุดท้าย และสามารถลดข้อผิดพลาดของการขอคืนภาษีอากรลดลงได้เหลือไม่เกินร้อยละ10 ของชิปเม้นที่มีการขอคืน FTA form JTEPA ทั้งหมด ผู้จัดทำได้ทำการศึกษากระบวนการสำหรับงานวิจัยในครั้งนี้จากการทำงานจริงในแผนก GS/OSD4-APAC21 ของบริษัทกรณีศึกษา ไปถึงการเก็บรวบรวมข้อมูลจากการสอบถามบุคคลที่เชี่ยวชาญในด้านนี้โดยเฉพาะ ซึ่งจากการศึกษาพบว่า กระบวนการสงวนสิทธิ์และขอคืนอากร FTA Form JTEPA นั้น เป็นกระบวนการที่ไม่ซับซ้อน แต่เน้นให้ความสำคัญในเรื่องของเอกสารที่จะต้องมีความสมบูรณ์ ถูกต้อง และครบถ้วน รวมไปถึงการให้ความสำคัญในเรื่องของการสื่อสารระหว่างทางองค์กรกับชิปปิ้งที่ได้ทำการจ้างวานให้กระทำการแทนบริษัท ตั้งแต่การดำเนินศุลกากรขาเข้า ตลอดไปจนถึงการติดต่อฝ่ายขอคืนขอคืนอากร ซึ่งจะเน้นไปที่ความถูกต้องของเอกสารใบขนขาเข้า เนื่องจากเป็นเอกสารที่สำคัญที่ถือว่าเป็นเอกสารหลักในการขออากรคืน โดยต้องถูกต้อง ตรงกับเอกสารที่เกี่ยวข้อง ไม่ผิดไปแม้แต่จุด ขีด เว้นวรรค หรือเคาะเดียว เพราะจะมีผลที่อาจทำให้เกิดความล่าช้า เพิ่มกระบวนการ หรืออาจทำให้บริษัทไม่อาจขอคืนอากรที่สงวนไว้ได้ ซึ่งหลังจากได้ศึกษากระบวนการสงวนสิทธิ์และขอคืนแล้ว ทำให้เราสามารถเข้าใจในกระบวนการมากขึ้น โดยเข้าใจในรายละเอียดแต่ละขั้นตอน รวมถึงจุดสำคัญในขั้นตอนต่างๆที่จะต้องพึงระวังห้ามให้มีความผิดพลาด และสามารถลดระยะเวลาในการทำงานด้านการขอคืนแต่ละชิปเม้นตั้งแต่กระบวนการแรกตลอดถึงกระบวนการสุดท้าย รวมถึงสามารถลดข้อผิดพลาดของการขอคืนภาษีอากรลดลงได้เหลือเพียงไม่เกินร้อยละ10 ของชิปเม้นที่มีการขอคืน FTA form JTEPA ทั้งหมด ทำให้บริษัทได้รับประโยชน์ในการได้คืนภาษีอากรให้กับบริษัทได้อย่างมีประสิทธิภาพ
ระบบสารสนเทศในการจัดส่ง,งานวิจัยนี้มีวัตถุประสงค์เพื่อเพิ่มประสิทธิภาพกระบวนการดำเนินงานของแผนก Documentation & CSR บริษัทสายเรือกรณีศึกษาแห่งหนึ่งในขั้นตอนการแลกเอกสาร Deliver Order (D/O) แบบปกติและแบบอิเล็กทรอนิกส์ (E-D/O) โดยผู้ทำวิจัยเริ่มต้นด้วยการศึกษาข้อมูลของบริษัทและกระบวนการดำเนินงานของแผนก Documentation & CSR โดยใช้แผนผังงาน (Flow Chart) เพื่อให้สามารถมองเห็นภาพรวมของกระบวนการดำเนินงานในปัจจุบันได้อย่างชัดเจน จากนั้นวิเคราะห์หาสาเหตุของปัญหาที่เกิดขึ้นในกระบวนการดำเนินงานด้วยแผนผังแสดงเหตุและผล (Cause and Effect Diagram) สุดท้ายจึงศึกษาหาแนวทางการพัฒนาปรับปรุงและแก้ไขปัญหาที่เกิดขึ้นในกระบวนการดำเนินงานของแผนก Documentation & CSR โดยนำแนวคิดลีน (Lean Management) และหลักการ ECRS มาประยุกต์ใช้ ซึ่งผลลัพธ์ที่คาดการณ์ว่าจะเกิดขึ้นหลังการปฏิบัติตามแนวทางการพัฒนาปรับปรุงกระบวนการดำเนินงานของแผนก Documentation & CSR คือ สามารถลดระยะเวลาการดำเนินงานในขั้นตอนการตรวจสอบระยะเวลา Free Time Demurrage (DEM) ลงได้ ซึ่งส่งผลต่อเนื่องให้ระยะเวลาโดยรวมของกระบวนการดำเนินงานของแผนก Documentation & CSR ในขั้นตอนการแลกเอกสาร D/O แบบปกติและแบบอิเล็กทรอนิกส์ (E-D/O) ลดลง ในด้านความถูกต้องผู้ทำวิจัยคาดการณ์ว่าจะสามารถลดการเกิดความผิดพลาดในขั้นตอนการตรวจสอบระยะเวลา Free Time Demurrage (DEM) และสามารถลดการเกิดความผิดพลาดในขั้นตอนอื่นลงได้อีกด้วย ส่งผลให้กระบวนการดำเนินงานของแผนก Documentation & CSR ในขั้นตอนการแลกเอกสาร D/O แบบปกติและแบบอิเล็กทรอนิกส์ (E-D/O) มีประสิทธิภาพเพิ่มมากขึ้น สามารถยกระดับการให้บริการแก่ลูกค้าให้ดียิ่งขึ้น
การเพิ่มประสิทธิภาพการดำเนินงานในการจัดการคลังสินค้าสำเร็จรูป,"การวิจัยในครั้งนี้ มีวัตถุประสงค์เพื่อเสนอแนวทางการเพิ่มประสิทธิภาพการดำเนินงานในการจัดการคลังสินค้าสำเร็จรูป และเพื่อปรับเปลี่ยนกระบวนการทำงานภายในคลังสินค้าสำเร็จรูป ที่นำไปสู่การลดระยะเวลาในการทำงานให้สามารถตอบสนองความต้องการของลูกค้าได้อย่างถูกต้องและรวดเร็ว ตลอดจนเพื่อศึกษารูปแบบการจัดเก็บสินค้าภายในคลังสินค้าสำเร็จรูปที่เหมาะสม โดยการศึกษาในครั้งนี้ได้ศึกษาข้อมูลกระบวนการดำเนินงานภายในคลังสินค้าสำเร็จรูปที่บริษัทกรณีศึกษาดำเนินการอยู่ด้วยแผนภูมิการไหล (Flow process chart) รวมถึงรวบรวมข้อมูลการจัดเก็บสินค้า และข้อมูลจากการสัมภาษณ์ผู้ปฏิบัติงานที่เกี่ยวข้อง จากนั้นจึงนำมาวิเคราะห์และทำความเข้าใจถึงปัญหาที่เกิดขึ้นด้วยแผนภาพก้างปลา (Fishbone diagram) ภายหลังการวิเคราะห์พบปัญหาหลัก 2 ปัญหาคือปัญหากระบวนการทำงานของพนักงานมีความซ้ำซ้อนกันและปัญหาภายในคลังสินค้าสำเร็จรูปไม่มีการจัดวางที่เหมาะสม ไม่มีการแบ่งกลุ่มสินค้า ทำให้สินค้าปะปนกัน ด้วยเหตุนี้จึงนำหลัก ECRS ซึ่งเป็นแนวคิดที่นำมาใช้เพื่อปรับปรุงกระบวนการทำงานให้มีประสิทธิภาพ และ นำทฤษฎี ABC Analysis มาทำการจัดกลุ่มความสำคัญของสินค้าเพื่อการวางแผนพื้นที่ในการจัดวางต่อไป จากการศึกษาพบว่า กระบวนการดำเนินงานในปัจจุบันมี 11 ขั้นตอน ภายหลังการเสนอให้ใช้หลัก ECRS ในการวิเคราะห์และปรับปรุงกระบวนการดำเนินงาน พบว่ากระบวนการดำเนินงานภายในคลังสินค้าสำเร็จรูปมีความซ้ำซ้อนกัน โดยมีขั้นตอนกระบวนการดำเนินงานที่สามารถรวมกันได้ 2 ขั้นตอน จัดเรียงลำดับการดำเนินงานใหม่ได้ 1 ขั้นตอน และปรับปรุงกระบวนการดำเนินงานได้ 1 ขั้นตอน นอกจากนี้ผู้วิจัยทำการศึกษาการบริหารการจัดเก็บสินค้าภายในคลังสินค้าสำเร็จรูปและทำการแบ่งกลุ่มสินค้าโดยใช้ทฤษฎี ABC Analysis หรือ การวิเคราะห์จัดกลุ่มด้วยระบบ ABC ตามความถี่ในการเคลื่อนไหวหรือการจัดส่ง พบว่า กลุ่มสินค้า A ที่มีความถี่ในการเคลื่อนไหวหรือการจัดส่งและมีมูลค่ารวมสูงสุด จำนวน 86 รายการ คิดเป็นร้อยละ 65.09 กลุ่มสินค้า B ที่มีความถี่ในการเคลื่อนไหวหรือการจัดส่งรวมปานกลาง จำนวน 118 รายการ คิดเป็นร้อยละ 24.94 และกลุ่มสินค้า C ที่มีความถี่ในการเคลื่อนไหวหรือการจัดส่งรวมน้อยสุด จำนวน 140 รายการ คิดเป็นร้อยละ 9.84 จากนั้นจึงนำข้อมูลการแบ่งกลุ่มสินค้าข้างต้นมาออกแบบคลังสินค้าสำเร็จรูปแบบใหม่ ภายหลังการปรับเปลี่ยนกระบวนการดำเนินงานและปรับรูปแบบการจัดเก็บสินค้าสำเร็จรูปภายในคลังสินค้าแบบใหม่ โดยจัดวางสินค้าตามกลุ่มสินค้าที่แบ่ง A,B และ C อีกทั้งยังมีการจัดเตรียมพื้นที่สำหรับวางพาเลทเปล่า, พื้นที่สำหรับวางสินค้าไม่เต็มพาเลทรวมถึงพื้นที่สำหรับสินค้า Dead Stock ผู้วิจัยได้ทำการสุ่มจับเวลาขั้นตอนในกระบวนการดำเนินงานตั้งแต่ขั้นตอนแรกจนถึงขั้นตอนสุดท้าย โดยผลลัพธ์ระยะเวลาที่ได้คือ สามารถลดระยะเวลาการดำเนินงานทั้งหมดจากเดิมก่อนการปรับปรุง คือ 151.38 นาที และระยะเวลาที่ใช้หลังการปรับปรุงโดยคาดการณ์ คือ 123.61 นาที ส่งผลให้ระยะเวลาในการดำเนินงานลดลง 27.77 นาที หรือคิดเป็นร้อยละ 18.34"
การเปรียบเทียบต้นทุนการขนส่งนำเข้าวัตถุดิบจากประเทศเวียดนาม บริษัทผลิตชิ้นส่วนรถยนต์แห่งหนึ่ง,การศึกษาวิจัยเรื่องการเปรียบเทียบต้นทุนการขนส่งนำเข้าวัตถุดิบจากประเทศเวียดนาม มีวัตถุประสงค์เพื่อศึกษาเปรียบเทียบรูปแบบการขนส่งวัตถุดิบจากประเทศเวียดนาม 2 รูปแบบ คือ การขนส่งสินค้าทางเรือและการขนส่งสินค้าทางรถบรรทุก และเพื่อศึกษาหาแนวทางการแก้ปัญหาค่าใช้จ่ายการนำเข้าวัตถุดิบจากประเทศเวียดนาม การศึกษาครั้งนี้ผู้วิจัยได้ทำการศึกษาในรูปแบบการวิจัยเชิงคุณภาพมีการรวบรวมข้อมูลจากบทความ งานวิจัย และเอกสารจากแหล่งข้อมูลต่าง ๆ และสัมภาษณ์พนักงานที่มีประสบการณ์ในการนำเข้าส่งออก โดยจะทำการเปรียบเทียบค่าใช้จ่ายของการขนส่ง 2 รูปแบบ คือ การขนส่งทางเรือและการขนส่งทางรถบรรทุกด้วยตู้คอนเทนเนอร์ขนาด 40 ฟุต เมื่อนำมาเปรียบเทียบพบว่าค่าใช้จ่ายในการนำเข้าวัตถุดิบในเดือนมกราคม ค.ศ. 2022 จำนวน 3 Shipment มีค่าใช้จ่ายในการนำเข้าทางเรือที่ค่อนข้างสูงกว่าการนำเข้าทางรถบรรทุก เนื่องจากการแพร่ระบาดของโรค โควิด-19 ทำให้เกิดการขาดแคลนตู้คอนเทนเนอร์ ส่งผลให้อัตราค่าระวางเรือ (Freight) มีราคาสูงขึ้น ทำให้บริษัทได้รับผลกระทบโดยตรงจากการนำเข้าวัตถุดิบ จึงได้หาแนวทางแก้ไขเพื่อเป็นลดค่าใช้จ่ายการนำเข้า ดังนั้นการนำเข้าวัตถุดิบจากประเทศเวียดนามช่วงเดือนมกราคม ค.ศ. 2022 ทั้ง 3 Shipment จะทำการนำเข้าทางรถบรรทุกเพราะจากการเปรียบเทียบค่าใช้จ่ายมีราคาที่ถูกกว่าการนำเข้าทางเรือ ส่วนการนำเข้ารอบอื่น ๆ จะใช้การนำเข้าทางเรือปกติเพราะค่าระวางเรือมีแนวโน้มลดลงอย่างต่อเนื่องทำให้ค่าใช้การนำเข้าวัตถุดิบทางเรือลดลงตามไปด้วย
กรณีศึกษาปัจจัยเชิงสาเหตุของความล่าช้าหรือไม่เป็นไปตามแผนการผลิตที่วางไว้,งานวิจัยนี้เป็นการศึกษาเพื่อหาสาเหตุของปัญหาความล่าช้าหรือไม่เป็นไปตามแผนกระบวนการผลิตที่วางไว้ทำให้กระบวนการผลิตไม่ได้ประสิทธิภาพมากพอ กรณีศึกษา โดยมีวัตถุประสงค์เพื่อเสนอแนะหาแนวทางการแก้ไขหรือลดปัญหาความล่าช้าหรือไม่เป็นไปตามแผนการผลิตที่วางไว้ ผู้วิจัยได้ทำการศึกษาและหาแนวทางการแก้ไขปัญหาโดยการศึกษากระบวนการวางแผนการผลิตและสาเหตุของการปรับ-ลดแผนเพื่อนำเป็นวิเคราะห์หาสาเหตุของความล่าช้าหรือไม่เป็นไปตามแผนที่วางไว้ โดยใช้แผนผังก้างปลา และ Why-Why Analysis เป็นเครื่องมือในการศึกษา จากการศึกษาสาเหตุของปัญหาความล่าช้าหรือไม่เป็นไปตามแผนที่วางไว้ด้วยการวิเคราะห์โดยแผนผังก้างปลาทราบว่าสาเหตุที่ส่งผลมากที่สุดคือ วัตถุดิบ (Materials) และ เครื่องจักร (Machine) ในส่วนของวัตถุดิบคือการรอวัตถุดิบที่มาล่าช้าเนื่องจากกำหนดการมีการคลาดเคลื่อนและการสั่งวัตถุดิบผิด ส่วนของเครื่องจักรคือเครื่องจักรเสียบ่อยครั้งและมีการปรับปรุงบำรุงเครื่องจักร ณ ช่วงเวลาที่มีการผลิต ดังนั้นทั้งสองสาเหตุจึงส่งผลทำให้เกิดกระบวนการผลิตมีความล่าช้ากว่าที่ได้วางแผนไว้ ทางผู้วิจัยจึงสรุปข้อเสนอแนะที่ได้จากการวิจัย คือ ฝ่ายบำรุงรักษาควรทำการตรวจสอบเครื่องจักรก่อนฝ่ายผลิตทำการผลิตทุกครั้งเพื่อทำการซ่อมแซมได้ทันหรือใช้เวลาน้อยและมีการปรับตั้งค่าเครื่องจักรให้ถูกต้องเสมอ ส่วนของวัตถุดิบควรทำการวางแผนและตรวจการสั่งซื้อจาก Supplier ให้ถูกต้องเพื่อลดข้อผิดพลาด
