project,abstract
การปรับปรุงประสิทธิภาพคลังสินค้าและระบบบรรจุ,การเพิ่มประสิทธิภาพคลังสินค้าและระบบบรรจุ ของบริษัท อินเตอร์เนชั่นแนล ฟู๊ดส์ จํากัดผลิตเนื้อไก่แปรรูปส่งออกและจำหน่ายภายในประเทศจากปัญหาคลังสินค้าและระบบบรรจุที่มีผลกับการทำงาน และขั้นตอนการแก้ปัญหาที่ส่งผลให้การทำงานล่าช้าเกิดปัญหาหลักคือการจัดการคลังสินค้าไม่เป็นระบบ สินค้าถูกวางรวมกันยากต่อการจำแนกและบรรจุสินค้าเข้าตู้คอนเทนเนอร์ไม่ทันเวลา ทำให้ตู้คอนเทนเนอร์เสียอุณหภูมิ เครื่องมือไม่เพียงพอการศึกษาใช้แผนผังก้างปลาวิเคราะห์ปัญหา และ ECRS มาปรับใช้กับหลักการ Visual Control ประยุกต์ปรับปรุงการทำงานของพนักงานและผู้ปฏิบัติงาน ผลการศึกษาพบว่าแนวทางการทำงานก่อนที่มีการปรับปรุงเวลาเฉลี่ย 46 นาที หลังปรับปรุงเวลาเฉลี่ย 39 นาที ลดลงจากเดิม 7 นาทีทำให้ตู้สินค้าไม่เสียอุณหภูมิ ปัญหาสินค้าถูกวางรวมกันน้อยลง การจัดวางใหม่ง่ายต่อการจำแนกทำให้พนักงานหาสินค้าได้ง่ายขึ้นไม่มีการปะปนสินค้าและบรรจุสินค้าได้ทันเวลา พนักงานมีเวลาพักมากยิ่งขึ้นเนื่องจาก รวมการทำงานเข้าด้วยกันทำให้ไม่เสียเวลาโดยเปล่าประโยชน์ ข้อเสนอแนะควรมีการจัดอบรมพนักงาน และเพิ่มอุปกรณ์ให้เพียงพอต่อการทำงาน
ข้ันตอนการปฏิบตังิานของแผนกบริการลูกค้า Customer Service (CS) ต่อลูกค้าในกลุ่มบริษัทผู้นำเข้าสินค้าประเภท Aluminum Coil,การวิจัยครั้งนี้มีวัตถุประสงค์เพื่อเรียนรู้ภาพรวม ขั้นตอนการทำงานและวิธีการประสานงานของหน่วยงานต่างๆที่ ของแผนกบริการลูกค้าหรือ Customer Service (CS) ของบริษัท  ลอจิสติคส์ และเพื่อเป็นแนวทางการศึกษาให้กับนิสิตอื่นๆที่มีความสนใจเกี่ยวกับแผนกบริการลูกค้าหรือCustomer Service (CS) โดยใช้วิธีการสัมภาษณ์พนักงานในแผนก และนอกจากนี้ยังใช้วิธีการสังเกตแบบมีส่วนร่วมในกิจกรรมของการปฏิบัติงานจริงจากการศึกษาพบว่าบริษัท  ลอจิสติคส์ ให้ความสำคัญกับการให้บริการอย่างมีคุณภาพ และมีการอำนวยความสะดวกให้แก่ลูกค้าเป็นอย่างดี ซึ่งพนักงานมีความเชี่ยวชาญในด้านการทำงาน การติดต่อสื่อสาร ทำให้ลูกค้าที่เข้ามาใช้บริการมีความมั่นใจได้ว่าจะไม่มีข้อผิดพลาดหรือความเสียหายที่เกิดจากการขนส่งที่ไม่ถูกต้อง ผู้วิจัยจึงได้ศึกษากระบวนการทำงานของแผนก Customer Service (CS) เพื่อให้ผู้วิจัย และผู้ที่มีความสนใจเกี่ยวกับแผนก Customer Service (CS) ได้มองเห็นถึงภาพรวมกระบวนการทำงานได้ง่ายมากขึ้น และนำไปใช้ประโยชน์ได้จริง
การจัด (Layout) การวางสินค้าในตู้คอนเทรนเนอร์,การวิจัยนี้มีจุดประสงค์เพื่อศึกษาขั้นตอนกระบวนการผลิตพาเลทไม้ และเสนอแนวทางการเพิ่มประสิทธิภาพของกระบวนการผลิตพาเลทไม้ ในแผนกการผลิต ของบริษัท บูรณาพา กรุ๊ป เพื่อนำปัญหาที่พบระหว่างการดำเนินขั้นตอนในการผลิตมาปรับปรุง และเพิ่มประสิทธิภาพให้กับกระบวนการผลิตพาเลทไม้ ให้สามารถดำเนินการผลิตได้อย่างรวดเร็ว และลดระยะเวลาในการทำงานให้มากที่สุด จากการศึกษานั้น พบว่าปัญหาส่วนใหญ่มาจากการดำเนินงานที่ซ้ำซ้อนที่ไม่สร้างมูลค่า จึงทำให้การดำเนินงานล่าช้า โดยผู้วิจัยได้นำระบบลีนมาใช้ในการปรับปรุงกระบวนทำงานและเพิ่มประสิทธิภาพของการทำงาน การระบุสาเหตุของปัญหาในกิจกรรมที่ไม่เพิ่มมูลค่าให้แก่บริษัทและนำมาวิเคราะห์ผลกระทบของปัญหาเพื่อนำไปสู่การเพิ่มประสิทธิภาพในการผลิต สารบัญ บทที่ หน้า
การศึกษาพัฒนาระบบการจัดการเอกสาร,การวิจัยครั้งนี้มีวัตถุประสงค์เพื่อ 1) เพื่อศึกษาระบบการจัดการเอกสารของบริษัท JST All Services 2) เพื่อศึกษาข้อผิดพลาดที่ส่งผลให้การค้นหาเอกสารล่าช้าหรือเอกสารสูญหาย และ 3) เพื่อศึกษาแนวทางในการพัฒนาการจัดการเอกสารให้มีประสิทธิภาพ กลุ่มประชากรที่ใช้ในการวิจัยครั้งนี้ เป็นพนักงานที่มีความเชี่ยวชาญเกี่ยวกับการทำเอกสารที่สำคัญต่างๆ ของบริษัท ซึ่งได้แก่ หัวหน้าและพนักงานที่ทำเกี่ยวกับเอกสารใบส่งของของบริษัท JST All Services จำนวน 4 ท่าน โดยเครื่องมือที่ใช้ในการวิจัยและเก็บรวบรวมข้อมูลในครั้งนี้ เป็นการสัมภาษณ์เชิงลึก (In-depth Interview) ด้วยแบบสัมภาษณ์ที่ผู้วิจัยสร้างขึ้นเอง โดยอาศัยแนวความคิดจาก ตํารา เอกสาร รายงาน ทฤษฎีและผลงานวิจัยต่างๆ ที่เกี่ยวข้อง โดยจะเป็นการสัมภาษณ์เกี่ยวกับระบบการจัดการเอกสารของ JST All Services ซึ่งแบบสัมภาษณ์ที่ผู้วิจัยเลือกใช้ เป็นแบบสัมภาษณ์แบบกึ่งมีโครงสร้าง (Semi –Structured interview) ผลการวิจัยพบว่า ระบบการจัดการเอกสารที่สำคัญต่างๆ มี 4 ขั้นตอน โดยเริ่มจากการรับเอกสารเข้ามาหรือการสร้างเอกสารขึ้นใหม่ จากนั้นพนักงานทำการตรวจสอบความถูกต้องของเอกสาร แล้วจึงทำการแยกประเภทของเอกสารต่าง ๆ และในขั้นตอนสุดท้ายจึงจะทำการจัดเก็บเอกสารเข้าแฟ้มตามหมวดหมู่ของเอกสาร ปัจจัยสำคัญที่ส่งผลให้การค้นหาเอกสารเกิดความล่าช้าหรือเอกสารเกิดการสูญหาย คือ ระบบการจัดการเอกสารของบริษัทที่ยังไม่มีประสิทธิภาพ และด้วยจำนวนของเอกสาร หรือลักษณะของแฟ้มที่ใส่เอกสารที่มีลักษณะที่คล้ายกันนั้น ส่งผลให้ค้นหาเอกสารได้ยากและอาจส่งผลให้การเก็บเอกสารเกิดความผิดพลาด และอีกปัจจัยที่สำคัญ คือ ปัจจัยด้านผู้ใช้เอกสาร โดยการที่บริษัทไม่มีนโยบายเกี่ยวกับการจัดการเอกสารที่ชัดเจน ทำให้ผู้ใช้เอกสารขาดความรู้ ความเข้าใจ ในเรื่องการจัดการเอกสาร แนวทางในการพัฒนาการจัดการเอกสารให้มีประสิทธิภาพ คือควรกำหนดแนวปฏิบัติเกี่ยวกับระบบการจัดการเอกสารของบริษัทให้มีความชัดเจนและเป็นมาตรฐานเดียวกัน และเพื่อป้องการการเกิดความล่าช้าในการทำงานบริษัทควรที่จะจัดตั้งบุคคลากรที่ดูแลเกี่ยวกับเรื่องระบบการจัดการเอกสารโดยตรง และควรหาวิธีที่จะสามารถแยกเอกสารแต่ละอย่างออกจากกันได้โดยง่าย
การศึกษากระบวนการการเรียกเก็บเงินจากผู้ผลิต กรณีศึกษาบริษัทผลิตชิ้นส่วนรถยนต์,การศึกษาถึงกระบวนการการเรียกเก็บเงินผู้ผลิตของบริษัทผลิตชิ้นส่วนรถยนต์ ผู้วิจัยมีวัตถุประสงค์เพื่อศึกษาถึงสาเหตุที่ผู้ซื้อมีการเรียกเก็บเงินจากผู้ผลิตและปัญหาหลังจากมีการเรียกเก็บเงินคืนจาก จากการศึกษาทำให้ทราบถึงสาเหตุของการเรียกเก็บเงินคืนจากทางผู้ผลิต นั่นคือ 1. สาเหตุจากสินค้ามีความเสียหาย ตำหนิ ชำรุด 2. การขนส่งสินค้าที่ไม่ทันต่อเวลาที่มีการวางแผนไว้ ซึ่งสาเหตุเหล่านี้นำไปสู่การเกิดปัญหาของทางบริษัทผลิตชิ้นส่วนรถยนต์ นั่นคือ ทำให้ไลน์การผลิตไม่สามารถผลิตต่อได้ ทำให้สินค้าไม่สามารถส่งถึงมือลูกค้าได้ทันเวลา ทำให้ทางบริษัทจะต้องมีการชดเชยค่าเสียหาย และต้นทุนอื่นๆที่เกิดขึ้นตามมา จึงทำให้ทางบริษัทผลิตชิ้นส่วนรถยนต์ต้องมีการเรียกเก็บเงินจากทางผู้ผลิตสินค้านั่นเอง ทางฝั่งผู้ผลิตเองนั้นก็จะต้องมีการปฏิเสธในเรื่องของสินค้าที่มีตำหนิ ชำรุด เสียหาย นั่นมีสาเหตุเพราะ 1. ความเสียหายของสินค้าหรือวัตถุดิบสามารถเกิดขึ้นได้อยู่แล้ว เนื่องด้วย Human error ที่อาจเกิดขึ้น เพราะฉะนั้นหากเรียกเห็บเงินค่าสินค้าที่มีความเสียหายแบบเต็มจำนวน ผู้ผลิตไม่สามารถแบกรับภาระตรงนี้ได้ทั้งหมด 2. สินค้าที่มีการรับแจ้งว่าเสียหายผู้ผลิตต้องการหลักฐานในการยืนยันว่าความเสียหายนั้นเกิดจากตัวผู้ผลิตเองหรือเกิดจากทางฝั่งบริษัทผู้ซื้อ จากปัญหาในการไม่ยอมรับการเรียกเก็บเงินนี้เองส่งผลให้บริษัทฝั่งผู้ซื้อเกิดผลกระทบ ทางด้านต้นทุน และเวลาเป็นอย่างมาก ผู้วิจัยจึงได้มีการนำเสนอแนวทางและทฤษฎีที่เกี่ยวข้องเพื่อช่วยป้องกันหรือลดปัญหาในเรื่องของข้อพิพาทและในด้านของเวลาได้ ดังนี้ 1. การประยุกต์ใช้วิธีการเจรจาต่อรองผ่านทฤษฎีเกมส์ (Game Theory) 2. เสนอแนะให้ทางฝั่งผู้ซื้อมีหลักฐานในการเก็บบันทึกเมื่อมีการตรวจสอบสินค้า 3. เสนอแนะให้ทางฝั่งผู้ผลิตประยุกต์ใช้ทฤษฎีการผลิตแบบทันเวลาพอดีและการผลิตแบบ 4. การใช้การขนส่งแบบ milk run เพื่อช่วยลดปัญหาด้านการขนส่งและต้นทุนค่าขนส่ง
การจำลองการวางแผนการสั่งซื้อบรรจุภัณฑ์เพื่อลดต้นทุนและลดการพึ่งพาคลังสินค้า,รายงานครั้งนี้ศึกษากิจกรรมการวางแผนการสั่งซื้อ การจัดเก็บ การจัดส่ง รวมถึงกระบวนการไหลของบรรจุภัณฑ์ทั้งในกระบวนการผลิตและบรรจุลงบรรจุภัณฑ์จนพร้อมจัดส่ง เพื่อศึกษาแบบจำลองการวางแผนความต้องการวัตถุดิบ มาประยุกต์ใช้ในการดำเนินกิจกรรม เพื่อลดการพึ่งพาคลังสินค้าและลดต้นทุนโดยรวม รายงานฉบับนี้ได้นำเอา Material Requirement Planning เป็นระบบที่ช่วยในการวางแผนความต้องการวัตถุดิบ และการจัดส่ง milk-run เข้ามาศึกษา ผลจากการศึกษาพบว่าการติดต่อกับคลังสินค้ามักจะมีปัญหาเกิดขึ้น ไม่ว่าจะมาจากการสื่อสารที่เข้าใจกันผิดพลาดหรือการดำเนินงานของสินค้าทั้งขารับสินค้าจากซัพพลายเออร์ จัดเก็บ และจัดส่งมายังโรงงาน และพบว่ามีการจัดเก็บบรรจุภัณฑ์ไว้เป็นจำนวนมากที่คลังสินค้าเพื่อรองรับการนำส่งมายังโรงงานเพื่อรองรับความต้องการของแผนกการผลิต ดังนั้นรายงานจึงทำการวางแผนการสั่งซื้อและจัดเก็บในปริมาณที่เหมาะสม และลดการพึ่งพาคลังสินค้าไปในขณะเดียวกัน กล่าวคือมีการวางแผนสั่งซื้อ ความถี่ในการรับสินค้าจากซัพพลายเออร์และจัดเก็บที่โรงงานเปรียบเทียบกับกระบวนการในปัจจุบัน พบว่าต้นทุนรวมของแนวคิดใหม่ทั้ง 2 แนวคิดลดลงจากแนวคิดปัจจุบัน โดยต้นทุนรวมของแนวคิดการจัดส่งทุกวันลดลงจากปัจจุบันร้อยละ 5.47 และต้นทุนรวมของแนวคิดการจัดส่งทุกสัปดาห์ลดลงจากปัจจุบันร้อยละ 8.39 และสามารถลดการพึ่งพาคลังสินค้าในจัดเก็บและกระบวนการที่เกี่ยวข้องกับคลังสินค้า
การประยุกต์แนวคิดลีนในกระบวนการขอใบอนุญาตนำเข้าสินค้าทางทะเล,การวิจัยนี้ มีวัตถุประสงค์เพื่อศึกษากระบวนการปัจจุบันของการยื่นขอใบอนุญาตนำเข้าสินค้าทางทะเลของบริษัทกรณีศึกษา เพื่อศึกษาการประยุกต์ใช้การจัดการแบบลีนต่อกระบวนการ รวมถึงเพื่อเปรียบเทียบขั้นตอนและระยะเวลา ก่อน-หลังการปรับปรุง โดยในการศึกษาครั้งนี้เป็นการประยุกต์ใช้ด้วยหลักการแผนผังสายธารแห่งคุณค่า (Value stream mapping) มาวิเคราะห์กระบวนการในปัจจุบันเพื่อหาความสูญเปล่า จากนั้นแบ่งขั้นตอนการทำงานออกเป็น 2 ประเภท คือแบบ Controllable Processes และ Uncontrollable Processes เพื่อนำหลักการ E-C-R-S มาใช้หาแนวทางการปรับปรุง เพื่อกำจัดความสูญเปล่า ที่เกิดขึ้นในขั้นตอนและลดเวลาลีดไทม์ ผลจากการวิจัย พบว่า สามารถลดขั้นตอนและระยะเวลาการทำงานโดยรวมลงได้ จากเดิม 22 ขั้นตอน ในระยะเวลา 30 วัน 30 นาที เหลือ 21 ขั้นตอน ในระยะเวลา 29 วัน 23 ชั่วโมง 40 นาที ซึ่งถ้าหากนำมาคิดคำนวณแค่ในส่วนของ Controllable Processes หรือกระบวนการที่ควบคุมได้ หรือส่วนงานของทีม Custom-Clearance โดยที่ไม่รวมกับระยะเวลาการรอคอยของเจ้าหน้าที่ในการตรวจสอบ พิจารณา และอนุมัติคำขอต่างๆ จากเดิมก่อนการปรับปรุงมีกระบวนการอยู่ทั้งสิ้น 15 ขั้นตอน ใช้ระยะเวลา 7 ชั่วโมง 45 นาที เหลือเพียง 14 ขั้นตอนในระยะเวลา 6 ชั่วโมง 55 นาที ซึ่งสามารถลดระยะเวลารวมไปได้ถึง 50 นาที หรือคิดเป็นร้อยละ 10.75 ซึ่งทำให้เห็นว่าหลังการปรับปรุงกระบวนการโดยการประยุกต์ใช้แนวคิดแบบลีนนั้น ทำให้ขั้นตอนการทำงานของกระบวนยื่นขอใบอนุญาตมีประสิทธิภาพเพิ่มมากขึ้น ในขั้นตอนและระยะเวลาที่ลดลง
